{
  "schema_version": 1,
  "ascribe_version": "{version}",
  "from": "examples/quill/docs/install-agent.md",
  "target": "keys.md#rotate-keys",
  "exists": true,
  "kind": "heading",
  "path": "keys.md",
  "id": "rotate-keys",
  "title": "Rotate keys",
  "href": "keys.md#rotate-keys",
  "problem": null,
  "closest": [],
  "lines": [
    {
      "build": "site",
      "line": "3.5",
      "page": "keys.md",
      "leads_to": null
    },
    {
      "build": "site@3.4",
      "line": "3.4",
      "page": "keys.md",
      "leads_to": null
    }
  ]
}
